organization,location,description,website
Joshua Venture Group,United States,"Joshua Venture Group invests in leaders with unique ideas that we believe will significantly impact the Jewish world. Social entrepreneurs selected to participate in our Dual Investment Program receive over $100,000 in funding and support – including training, exposure and access to networks in the Jewish world – which equip them to realize their visions and to transform the Jewish landscape.",http://joshuaventuregroup.org/
JPRO Network,United States,"JPRO Network, formerly Jewish Communal Service Association of North America, is a network of local groups, comprised of Jewish community professionals in North America. JPRO is not only a shortened form for Jewish Professional, the PRO also stands for Professional Resource Organization. The mission is to Connect, Educate, Inspire and Empower Jewish community professionals.",http://jpro.org/
Judaism and Democracy Action Alliance of North America Inc.,United States,"The goal of Judaism and Democracy Action Alliance of North America is to enhance popular appreciation of the value placed by traditional Jewish texts and teaching on civic involvement, democratic principles, civil dialogue among different population groups, the promotion of peace, the lessening of inter-group tensions, and the protection of human dignity. ",
Juvenile Diabetes Research Foundation,Canada,"For over 40 years, JDRF has been a global leader in the search for an end to type 1 diabetes (T1D), through both research funding and advocacy. JDRF’s research is committed to improving the lives of every person with T1D and to curing this disease. JDRF's research goals are realized by the projects being supported in three basic areas: Cure, Treat, Prevent.",http://www.jdrf.ca/
Kehilat Kol HaNeshama,Israel,Congregation Kol Haneshama is an active & lively center for Progressive Judaism in Jerusalem. The kehilla is located in Baka. Our community is founded upon the core value of equality. We believe that every one is created in the image of God and in the Jewish value of responsibility for one another.,http://www.kolhaneshama.org.il/Eng/kolhaneshama
Kerem Institute for Teacher Training for Humanistic-Jewish Education,Israel,"Kerem Institute for Teacher Training for Humanistic-Jewish Education recruits promising university students and trains them to become an outstanding educators in Jewish studies, humanities and the arts.  Dedicated to integrating modern Western values and Jewish culture, Kerem prepares teachers to meet today's educational challenges with openness and respect for all students.  Kerem stresses practical teaching experience and innovative approaches that bring literature, history, art, Bible and Jewish thought alive for children of different backgrounds.  Studies at Kerem are tuition-free in exchange for a commitment from each graduate to teach at least three years full-time or five years part-time upon completion of the program.  This request is to support financing of scholarships for young teachers.",
Keren Klita,Israel,"Keren Klita, a voluntary organization providing aid and support for immigrants from the former Soviet Union has now been integral to the successful assimilation of immigrants in the region for some years. ",http://www.one-to-one.org/projects/keren-klita-programme-for-immigrants-in-jerusalem/
Kesher Inc.,Israel,Kesher Inc. is an organization/program which helps Israelis living abroad to stay informed about and involved in Israeli civic life.  These funds were used to help Israelis living in the U.S. and Europe to fly to Israel for the 1999 elections.,
Kivunim,United States,"KIVUNIM is a program in international Jewish education. At a time when both Americans in general and American Jews in particular are feeling increasingly alienated from the broader world around, KIVUNIM provides an intensive academic and experiential encounter with Middle Eastern, North African, Asian and European cultures and our unique program dramatically expands and broadens the perspective of our students.",http://www.kivunim.org/
Kolel: The Adult Centre for Liberal Jewish Learning,Canada,"Since its inception in 1991, Kolel has established its reputation as a dynamic, pluralistic, egalitarian institution where men and women can engage in Jewish learning which values both traditional and liberal interpretations.",
Koret Israel Economic Development Funds,Israel,KIEDF was established in 1994 to demonstrate that deploying philanthropy efficiently and effectively can stimulate private sector economic expansion and create employment opportunity in Israel.,http://www.kiedf.com/
Les Amis de la montagne,Canada,"Les amis de la montagne exists to protect and enhance Mount Royal through community involvement and environmental education. A registered charitable organization founded in 1986, Les amis de la montagne’s network includes citizens from a variety of associations allied with the heads of philanthropic foundations and company presidents. All share the same passion, that of protecting and enhancing the mountain.",http://www.lemontroyal.qc.ca/en/learn-about-mount-royal/homepage.sn
Lincoln Center for the Performing Arts,United States,"Lincoln Center (Lincoln Center for the Performing Arts) serves three roles: world’s leading presenter of superb artistic programming, national leader in arts and education and community relations, and manager of the Lincoln Center campus.",http://www.lincolncenter.org/
Little League ,United States,"Better than any other youth sport activity, baseball and softball have become the thread that has sewn together a patchwork of nations and cultures around the world. Little League is a heritage to be carried forward proudly in the future by ever increasing waves of those devoted to teaching children how to play and enjoy these great games.",http://www.littleleague.org/Little_League_Online.htm
L'Opéra de Montréal,Canada,"Opéra de Montréal, the largest francophone opera company in North America. The Opéra is a key player in Montreal’s economic, cultural, and social development since, season after season, it maintains working relationships with over 360 local businesses and hires over 800 artists and artisans.",http://www.operademontreal.com/en
Maccabi Canada,Canada,At Maccabi Canada we work to develop and promote a Jewish identity in our youth so they can become the future leaders of our community.   We achieve our goal through the passion of sports. ,http://www.maccabicanada.com/
Maison Shalom House Inc.,Canada,"Treiser Maison Shalom is a professionally run group home where people with intellectual, emotional and physical disabilities are cared for in a safe, stimulating and family style atmosphere. The homes (2 duplexes), have permanent residents and also care for a large number of respite children and young adults, providing short and long term relief for families of individuals with special needs.",http://treisermaisonshalom.com/
Massachusetts Institute of Technology,United States,"The mission of MIT is to advance knowledge and educate students in science, technology and other areas of scholarship that will best serve the nation and the world in the 21st century — whether the focus is cancer, energy, economics or literature.  ",http://web.mit.edu/
Masorti School,Israel,"The goal of the Masorti (Tali) Schools Project is to help overcome the gaps between religious and non-religious Jews and between people of different ethnic backgrounds.  The grant was intended to support the work of the institution in training Israeli educators in informal education, writing curriculum for the growing Tali School system, and enriching the MA Program, which was developed by the Beit Madras for Israeli educators to broaden their educational vistas.",
McGill Institute for the Study of Canada,Canada,"The McGill Institute for the Study of Canada was established in 1994. Its mission is to promote a better understanding of Canada through the study of our heritage; develop a clearer understanding of Canada’s social, political and economic future; identify and explore the benefits that a pluralistic society offers; and, support the study of Canada across the country and internationally. In order to achieve these goals, the Institute encourages a multidisciplinary approach to the study of Canada; promotes public as well as university-based education about Canada; fosters the development of networks in the areas of Canadian Studies; and, enhances informed discussion of public policy. There are three core elements to MISC’s program: research; teaching at the graduate and undergraduate levels; and outreach to interested publics beyond the University community, including a program of public lectures and an annual conference on issues of public policy that are of current interest.",http://www.mcgill.ca/misc/
McGill University,Canada,"McGill University is one of Canada's best-known institutions of higher learning and one of the leading universities in the world. With students coming to McGill from some 150 countries, our student body is the most internationally diverse of any research-intensive university in the country.",http://www.mcgill.ca/
McMaster University,Canada,"At McMaster our purpose is the discovery, communication and preservation of knowledge. In our teaching, research, and scholarship, we are committed to creativity, innovation and excellence. ",http://www.mcmaster.ca/
Melitz-Centers for Jewish Zionist Education,Israel,"Melitz creates and provides high quality educational programs in Israel, the US, and worldwide that strengthen commitment to the Jewish people, to a democratic Israel, and to the Israel-Diaspora relationship. Our outstanding educators span the Jewish spectrum and take participants on a journey that provides them with tools to engage with Judaism and the Jewish world.",
Memorial Sloan Kettering Cancer Center,United States,"As one of the world's premier cancer centers, Memorial Sloan Kettering Cancer Center is committed to exceptional patient care, leading-edge research, and superb educational programs.",https://www.mskcc.org/
Memorial University of Newfoundland,Canada,"Memorial University is an inclusive community dedicated to creativity, innovation and excellence in teaching and learning, research and scholarship, and to public engagement and service.",http://www.mun.ca/
Merchavim - The Institute for the Advancement of Shared Citizenship,Israel,"Merchavim works to assist young citizens, from different backgrounds, to learn about the ‘other’, value the differences, develop a shared civic consciousness and make their classrooms, schools, and communities fairer. The Institute’s unique programming, developed in collaboration with the Ministry of Education, are based on five basic concepts: identity, accessibility, fairness, spaces of agreement, active shared citizenship and are adapted to each age groups, from kindergarten and up to high school.",http://www.machon-merchavim.org.il/?lang=en
Meuravut,Israel,"Established by Russian community activists, Meuravut created a project with The Association for the Advancement of Democracy in the Arab Sector. The project, Breaking down Barriers, educated a core group of journalists about the issues facing the Palestinian citizens of Israel and provided them with the knowledge and background to begin writing more analytical, in-depth stories on the minority experience in Israel.",
Meytarim - Network for Jewish Democratic Education,Israel,"Meytarim is the network for Jewish democratic education. It strives to reduce the religious/secular division in schools and creates a framework in which children from different ideological backgrounds can learn together. Schools affiliated with Meytarim foster a pluralistic and democratic environment in which Judaism is studied and practiced with commitment and yet openness. Academic excellence and achievement are fundamental goals of the Meytarim network. Meytarim schools have been accredited by the Ministry of Education and enable students the opportunity to study sacred texts, democratic values, and live in a pluralistic society which legitimates a variety of forms of Jewish expression. ",http://www.meytarim.org.il/
Miriam Foundation,Canada,The Miriam Foundation is dedicated to ensuring that greater insight and new research will improve the quality of life for all those affected with autism spectrum disorders (ASDs) and developmental disabilities.,http://www.miriamfoundation.ca/en/home.html
Montreal Association for the Blind Foundation,Canada,The mission of the MAB-Mackay Rehabilitation Centre is to maximize our clients’ autonomy and community participation in order to improve their quality of life.,http://www.mabmackay.ca/
Montreal Holocaust Memorial Center,Canada,"The Montreal Holocaust Memorial Centre educates people of all ages and backgrounds about the Holocaust, while sensitizing the public to the universal perils of antisemitism, racism, hate and indifference.",http://www.mhmc.ca/en
Montreal Museum of Fine of Arts,Canada,"The Montreal Museum of Fine Arts Foundation raises funds through campaigns, events, and various projects to support the Museum’s primary mission: the enhancement, conservation, and presentation of its encyclopedic collection, the presentation of major exhibitions, and the creation of various educational, art therapy, social/community programs.",http://www.mbam.qc.ca/en/
Montreal Neurological Institute and Hospital ,Canada,"The Montreal Neurological Institute and Hospital is the largest training center for brain research in Canada. For a quarter of a century, the Friends of the Neuro, a non-profit group of dedicated volunteers, has raised money for the hospital and helped patients and their families. The Friends purchase hospital equipment, fund bursaries for nurses, support the Patients' Committee, and do much more.",http://www.mcgill.ca/neuro/
MorseLife Foundation,United States,"MorseLife is a nationally recognized provider of health care, housing and support services for seniors and their families in Palm Beach County.",http://www.morselife.org/
Mount Allison University,Canada,"Mount Allison University’s beautiful and historically rich campus is nestled on the Tantramar marshes in the heart of Sackville, New Brunswick, Canada. We recruit, teach, and train young talent; we produce knowledge; we create opportunities and benefit the community; we are the site for major public discussions. ",http://www.mta.ca/Prospective/Default.aspx
Mount Saint Vincent University,Canada,"The Mount is located just minutes from downtown Halifax, Nova Scotia and is recognized for its small class sizes and personalized approach to learning. A diverse mix of 4,000 women and men from across Canada and more than 50 countries take advantage of the Mount’s programs and unique sense of community through on-campus classes and distance learning opportunities. ",http://www.msvu.ca/en/home/default.aspx
Mount Sinai Health System,United States,"The mission of the Mount Sinai Health System is to provide compassionate patient care with seamless coordination and to advance medicine through unrivaled education, research, and outreach in the many diverse communities we serve.",http://www.mountsinai.org/
Mount Sinai Hospital Foundation ,Canada,"Since the hospital’s inception in 1909 by members of the Jewish community, Mount Sinai has always stood for excellence. Mount Sinai Hospital Montreal is a public institution, treating patients referred by doctors throughout the province. It's mission is to treat people with chronic obstructive pulmonary diseases with a global approach including education, prevention, diagnostic, treatment and follow-up; to offer palliative care services to people at the end of their life to alleviate their suffering; to offer a homelike environment to people with serious chronic conditions.",http://sinaimontreal.ca/
MUSE Film and Television,United States,MUSE Film and Television is a non-profit executive production company that uses film and digital media to create quality films on visual art and culture.,http://www.musefilm.org/
Museum of Arts and Design,United States,"The Museum of Arts and Design (“MAD”) explores the blur zone between art, design, and craft today.",http://madmuseum.org/
Musica Eterna,Israel,"The association “Keshet Amanuyot”, which means “Rainbow of Arts” from Hebrew, was founded in the year of 1996. The main goal of the collective was foundation and organization of the new Israeli choir “Musica Aeterna”. With the years, the field of activities of the organization has broadened; nowadays it includes three grand projects. The association pays special attention to the cultural life in Jerusalem.",http://musica-aeterna.com/en/main/
Musicians on Call,United States,Musicians On Call brings live and recorded music to the bedsides of patients in healthcare facilities. ,http://www.musiciansoncall.org/site/PageNavigator/home
Musrara School of Photography,Israel,"The Naggar school of Photography, Media, New Music, Animation and Phototherapy in Musrara, Jerusalem, was set from the beginning to function as an institute with a different nature - open to it's environment, inspecting new approaches and dealing with hot issues concerning society in Israel.",http://musrara.org/
Na'amat Canada ,Canada,"Na’amat Canada, in partnership with Na'amat Israel, is part of a worldwide women’s movement whose ideological roots lie with the founding women of the State of Israel and their vision for social justice and equality. ",http://www.naamat.com/
National Baseball Hall of Fame ,United States,"The Hall of Fame's mission is to preserve the sport's history, honor excellence within the game and make a connection between the generations of people who enjoy baseball. ",http://www.baseballhall.org/
National Council of Jewish Women of Canada,Canada,"The National Council of Jewish Women of Canada is a voluntary organization which, in the spirit of Judaism, is dedicated to furthering human welfare in the Jewish and general communities Locally, Nationally and Internationally. Through an integrated program of education, service and social action, the organization helps to fulfil unmet needs and to serve the individual and the community.",http://www.ncjwc.org/
National Entertainment Fund for the Cultural Arts,United States,"The National Entertainment Fund for the Cultural Arts’ mission is to foster and maintain an appreciation for culture through the arts, and to innovatively promote the strengthening of cultural identity.",http://www.nefca.org/
National Gallery of Canada Foundation,Canada,"The National Gallery of Canada is one of the world's most respected art institutions, renowned for its exceptional collections, revered for its scholarship, and applauded for its unique ability to engage audiences of all ages and all levels of artistic knowledge. Created in 1880, the National Gallery of Canada is among the oldest of Canada's national cultural institutions.  The National Gallery of Canada strives to provide Canadians with a sense of identity with and pride in Canada's rich visual-arts heritage. Through its collections, onsite and traveling exhibitions, loans program, educational programs and publications, professional training programs, and outreach initiatives, the Gallery aspires to be a model of excellence in furthering knowledge of the visual arts, both at home and abroad. Through collaboration with national and international institutions, the Gallery seeks to make art accessible, meaningful, and vital to diverse audiences of all ages.  The Foundation created The Andrea and Charles Bronfman Canadian Art Fund in 2002 to increase the National Gallery’s ability to purchase exceptional examples of Canadian artwork. The first acquisition is “In The Orchard” 1892 –oil on board- by William Brymner. The second acquisition is “Alcove” 1914 –oil on canvas- by David B. Milne. ",http://www.gallery.ca/en/
National Museum of American Jewish History,United States,"The National Museum of American Jewish History’s mission is to present educational programs and experiences that preserve, explore and celebrate the history of Jews in America. Our purpose is to connect Jews more closely to their heritage and to inspire in people of all backgrounds a greater appreciation for the diversity of the American Jewish experience and the freedoms to which Americans aspire.",http://www.nmajh.org/
Nefesh B’Nefesh,United States,"Nefesh B’Nefesh in cooperation with the Israeli government and The Jewish Agency for Israel, is dedicated to revitalizing Aliyah from the USA, Canada and the UK by removing or minimizing the financial, professional, logistical and social obstacles of Aliyah and the move to Israel.",http://www.nbn.org.il/
Neve Tzedek Theatre Group,Israel,Theater North was an eight month project to develop a local community theatre in Yavne  and a tour of the Galilee towns.,
New York Philharmonic,United States,"The New York Philharmonic is by far the oldest symphony orchestra in the United States, and one of the oldest in the world.  Since its first concert in 1842 the Philharmonic has played a leading role in American musical life.",http://nyphil.org/
North American Alliance for Jewish Youth,United States,"The mission of the North American Alliance for Jewish Youth is to promote excellence in the field of Informal Jewish Education, and to provide every Informal Jewish Educator with meaningful, content-rich opportunities to strengthen and enhance their professional skills.",http://naajewishyouth.org/
North American Forum,United States,"Founded in 2005, the North American Forum is a community of Canadian, Mexican and American thought leaders, whose purpose is to advance a shared vision of North America, and to contribute to improved relations among the three neighbors.",http://www.hoover.org/about-north-american-forum
North American Jewish Forum - UJA,United States,"In October, 1987, The CRB Foundation announced its decision to provide over 3 year (and then extended 2 more years) period to enable the creation of the North American Jewish Forum.  This support for the year 1988, 1989 and 1990 reflected the recognition of the need to establiah a North American counterpart to the Israeli Forum so that processes underway since the early 1980's of enhancing Diaspora-Israel relations through intensive dialogues and selected projects could mature and develop. Please note that the United Jewish Appeal merged with CJF and UIA to form the UJA Federation of North America in 1998.",
North-South Institute,Canada,The North-South Institute is Canada's oldest independent policy research institution specializing in effective international development. At NSI we focus on identifying policies and practices seeking to reduce poverty and global inequalities thereby contributing to the creation of a more prosperous and stable global community.,http://www.nsi-ins.ca/
Norton Museum of Art,United States,"Since its founding in 1941, the Norton Museum of Art has grown and evolved to become one of Florida's major cultural institutions. The Museum is internationally known for its distinguished permanent collection featuring American Art, Chinese Art, Contemporary Art, European Art and Photography.",http://www.norton.org/
NYU Medical Center Foundation,United States,"We are committed to making world-class contributions that place service to human health at the center of an academic culture devoted to excellence in research, patient care, and education.",http://www.med.nyu.edu/
Ofakim-Horizons,Israel,Education program for new immigrants from the former Soviet Union to Israel.,
Ohr Torah Stone,United States,"Ohr Torah Stone is a Modern Orthodox movement shaping Jewish communities worldwide, inspired by the unique vision of founder Rabbi Shlomo Riskin. Fueled by a unique combination of educational institutions, rabbinical training, women’s empowerment programs, leadership development, outreach initiatives, and social action projects, OTS is illuminating the relevance of authentic Torah Judaism in the modern world.",https://ots.org.il/
Ontario Crafts Council,Canada,"As a dynamic, member-based, not-for-profit arts service organization, the OCC exists to grow recognition and appreciation of craft and craftspeople by building a strong, talented, distinct craft community.",https://www.craftontario.com/
ORT Montreal,Canada,"ORT’s mission is to work for the advancement of people through training and education; to provide communities wherever they are, with the skills and knowledge necessary to cope with the complexities and uncertainties of their environment; to foster economic self-sufficiency, mobility and a sense of identity through use of state-of-the-art technology. ",http://ortmontreal.org/
ORT Toronto,Canada,"ORT Toronto is a regional chapter and the head office of ORT Canada. We believe that when people and organizations work diligently together, they create change in Canada and in developing countries around the world.",http://www.ort-toronto.org/
Partnership for Excellence in Jewish Education,United States,The Partnership for Excellence in Jewish Education (PEJE) believes that day schools are essential for fostering an engaged Jewish people for an enduring Jewish future. PEJE connects and empowers Jewish day schools and major stakeholders in the Jewish community across the denominational and geographic spectrum and offers unparalleled knowledge and resources to foster financial sustainability and affordability.,http://www.peje.org/
