organization,location,description,website
21/64,United States,"21/64, founded in 2002, is a non-profit consulting division of the Andrea and Charles Bronfman Philanthropies that specializes in next generation and multi-generational strategic philanthropy.  At 21/64, they understand the unique skills and perspectives the next generation can bring to the philanthropic community. However, the prospect of engaging the next generation can be daunting. Next-generation family members have grown up with access to broader opportunities fueled by information technology, increased diversity and global connectedness. The questions they ask, language they use, and even their values and priorities change the way the family communicates. The more a family is able to see that “involving the kids” does not only mean adding children to an existing system, but rather shifting the family paradigm to become multigenerational--embracing what each generation brings to the table--the better prepared they will be for the next phase of their foundation’s evolution, and for meeting the needs of the 21st century.",http://www.2164.net
92nd Street Y,United States,"Founded more than a century ago to serve the Jewish people, 92nd Street Y promotes individual and family development and participation in civic life within the context of Jewish values and American pluralism.",http://www.92y.org/Contact.aspx
Acco Festival of Alternative Theatre,Israel,"The Acco Festival of Alternative Israeli Theatre, taking place again during the Intermediate Days of Sukkot, set out on its road 31 years ago and is one of the oldest and most exciting theatre festivals in Israel. The events of the Festival are produced by the Acco Municipality with the support of the Culture Administration of the Ministry of Culture and Sport, with all the productions receiving grants and entitled to ongoing artistic advising.",http://www.accofestival.co.il/
Acco Theatre Center,Israel,"The Acco Theater Center (ATC) blazes innovative paths in the realm of social theater, striving to forge strong alliances between Arab and Jewish artists, offering alternative paradigms and encouraging open and fruitful expression within our larger society.",http://www.acco-tc.com/eng
Ackerman Institute for the Family,United States,"Founded in 1960, the Ackerman Institute for the Family is one of the premier institutions for family therapy and one of the best-known and most highly regarded training facilities for family therapists in the United States. The Institute serves families from all walks of life at all stages of family life.",http://www.ackerman.org/
Advancing Women Professionals and the Jewish Community,United States,"Advancing Women Professionals and the Jewish Community (AWP) is a national non-profit organization whose mission is to advance women into leadership positions in Jewish life; stimulate Jewish organizations to become more equitable, productive and vibrant environments; and promote policies that support work-life integration and flexibility for professionals and volunteers.",http://advancingwomen.org/pages/about
Agenda – Israeli Center for Strategic Communications ,Israel,"Agenda, Israel’s only Center for Strategic Communications, is a unique not-for-profit center working to reprioritize and reframe social change issues within the Israeli public debate and media.",http://agenda.anu.org.il/english/
"Agudat Bet Sefer René Cassin, Singing City ",Israel,"The project's goal was to augment music education in 65 of Jerusalem's elementary schools, and to create employment for olim musicians. Approximately 1,500 children in Grades 3-6, who wished to, received instruments on loan througout the year, and play:  piano, violin, cello, wind instruments and more.",
AJEEC-NISPED,Israel,"Founded in 1998, AJEEC-NISPED (the Arab-Jewish Center for Equality, Empowerment and Cooperation – Negev Institute for Strategies of Peace and Development) is an Arab-Jewish nonprofit organization based in Israel’s Negev, dedicated to strengthening active citizenship through education and economic empowerment.",http://en.ajeec-nisped.org.il/
AJC- Global Jewish Advocacy,United States,"AJC's mission is to enhance the well-being of the Jewish people and Israel, and to advance human rights and democratic values in the United States and around the world. ",http://www.ajc.org
Akedia Productions Ltd.,Israel,The Kadeem Winds is a large scale film project on the ethnic rift between the Sephardim and the Askenaz. ,
Al Ahali,Israel,"Al Ahali is an independent not-for-profit organization established in 1999 to strengthen grassroots activism among Palestinian citizens in Israel. Ahali works through community organizing, used as a mean of struggle to obtain full citizenship and minority rights and thus ensuring equal distribution of national resources. ",
Aleh Rehabilitation Center for Brain Damaged Children,Israel,"ALEH believes that every child, regardless of the severity of the physical or cognitive disability, has the right to benefit from the best available care in order to reach his or her fullest potential.  ALEH is at the forefront of providing Israeli children with the high quality programs they need to maximize their potential.",https://aleh.org/
Alex Dworkin Canadian Jewish Archives,Canada,"The Alex Dworkin Canadian Jewish Archives (formerly known as the Canadian Jewish Congress Charities Committee National Archives) is a program of Jewish Federations Canada-UIA, and is supported by the Alex Dworkin Foundation for Jewish Archives, through Federation CJA. The Alex Dworkin Canadian Jewish Archives collects and preserves documentation on all aspects of the Jewish presence in Quebec and Canada.",http://www.cjccc.ca/
Alexander Muss Institute for Israel Education,United States,"Alexander Muss Institute for Israel Education is the premier academic Israel experience for Diaspora youth to enhance their cultural identity and link to Israel. AMHSI's mission is to promote, build, and strengthen lifelong bonds between youth and Israel through study of the history and culture of the people of Israel.",http://www.amhsi.org/
Alliance ProCURE,Canada,"Founded in 2003, PROCURE is the only charitable organization in Quebec to be exclusively dedicated to the fight against prostate cancer through research, awareness, education and support for men who have this disease and their families. PROCURE has its roots in the vision of one man, Marvyn Kussner, who fought prostate cancer and wanted to establish an organization to educate and support those concerned with

this diagnosis and to advance scientific research in this area.",http://www.procure.ca/
Alliance Quebec,Canada,"Founded in 1982 and disbanded in 2005, this advocacy group defended the interests of English-speaking Quebecers for over 20 years. The main thrust of its efforts was to protect the language rights of anglophones in Québec.",
Al-Qasemi Academic College of Education,Israel,"Al-Qasemi’s vision is to create an academic environment which facilitates and fosters both high quality intellectual achievement, and a culture of dialogue between religions, cultures, and traditions. Through partnership with other academic institutions within Israel and outside of the country, professional conferences and study days, and the incorporation of a diverse faculty, Al-Qasemi is actively working to create a new model for higher education. ",http://www.qsm.ac.il/Eng/
"Am Hofshi for Freedom of Religion, Conscience, Education & Culture",Israel,"Grant was made to fund educational and legal work for religious pluralism and tolerance in Israel. Israelis, whose personal rights are threatened, were helped by this aid to defend themselves.",
American Friends of Livnot U'Lehibanot,United States,"Livnot U’Lehibanot is an unaffiliated, non-profit organization that has been running co-ed Israel experience programs since 1980.  The programs facilitate an exploration of Israel and Jewish heritage through hiking, community service, seminars, and meaningful interactions with native and immigrant Israelis.  Livnot programming is geared for Jewish adults with little Jewish background.",http://www.livnot.org/contact-us/
American Friends of Rechov Sumsum,United States,"Rechov Sumsum encourages mutual respect and understanding among the country’s culturally and religiously diverse communities, while delivering other key aspects of children’s education, including Hebrew literacy and vocabulary, and coping with emergency situations. The show’s stories model peaceful problem solving and cultural acceptance on a “rechov,” or street, where Israelis of different ethnic and religious backgrounds live.",http://www.sesameworkshop.org/what-we-do/our-initiatives/rechov-sumsum/
American Jewish Joint Distribution Committee (JDC),United States,"The American Jewish Joint Distribution Committee (JDC) is the world’s leading Jewish humanitarian assistance organization. Since 1914, JDC has exemplified that all Jews are responsible for one another and for improving the well-being of vulnerable people around the world.",http://www.jdc.org/
American Jewish World Service,United States,"Inspired by Judaism’s commitment to justice, American Jewish World Service works to realize human rights and end poverty in the developing world.",http://ajws.org/
Ami-Da Institute,United States,Ami-Da Institute for training Russian Jewish leaders,
"Anwar Sadat Chair for Population, Development, and Peace, University of Maryland, College Park",United States,"The Anwar Sadat Chair for Peace and Development was established at the University of Maryland, College Park in the fall of 1997 in memory of the late Egyptian President Anwar Sadat. The Chair, under the leadership of the Sadat Professor Shibley Telhami, is housed in the Center for International Development and Conflict Management (CIDCM) and makes its academic home in the Department of Government and Politics. The Chair was made possible by the commitment of Anwar Sadat's widow, Dr. Jehan Sadat, to her husband's legacy of leadership for peace. With support from all levels of the University, Dr. Sadat created an endowment for the Chair from the generous support of many individual contributors from around the world.",http://sadat.umd.edu
"Aperture Foundation, Inc.",United States,"Support for book entitled ""Testimony."" ""Testimony"" contains fifty of Gillian Laub's portraits of Israeli Jews, Israeli Arabs, displaced Lebanese families, and Palestinians—each personally affected by the geopolitical context in which they live, and each an essential element in the puzzle of Middle East peace. The book also contains two essays, one by Palestinian-Israeli civil rights lawyer Raef Zreik and one by Israeli professor Ariella Azoulay, underline the complexity of the work and the dialogue it sparks.",
Arava Institute for Environmental Studies,Israel,"The Arava Institute for Environmental Studies (AIES) is the premier environmental education and research program in the Middle East, preparing future Arab and Jewish leaders to cooperatively solve the region's environmental challenges.",http://arava.org/about-our-community/contact/
Artis Contemporary Israeli Art Fund Inc.,Israel,Artis is an independent nonprofit organization that broadens international awareness and understanding of contemporary visual art from Israel.,http://www.artiscontemporary.org
Association for Industry Contacts with the Community,Israel,"""Taasiyeda"" (""Think Industry"") assumes that the future success of industry and education is inter-linked. It's therefore crucial to cultivate a younger generation that has attained practical experience in dealing with the principles and challenges of industry.  This cooperation between schools and industry is done through the theme of environment.",
Association of Israel's Decorative Arts (AIDA),United States,"AIDA's mission is to foster the development of contemporary decorative artists from Israel by connecting them to an international audience of galleries, institutions, and collectors.",http://www.aidaarts.org
Azrieli College of Engineering Jerusalem,Israel,"Established in 1999, Azrieli – College of Engineering Jerusalem (originally called The Jerusalem College of Engineering) is a non-profit organization that is committed to creating well-educated and highly trained professionals in the field of engineering. ",http://english.jce.ac.il/
Banff Centre for the Arts,Canada,"The Banff Centre's mission is inspiring creativity. Thousands of artists, leaders, and researchers from across Canada and around the world participate in programs here every year. Through its multi-disciplinary programming, The Banff Centre provides them with the support they need to create, to develop solutions, and to make the impossible possible. ",https://www.banffcentre.ca/
Bar-Ilan University,Israel,"Bar-Ilan University is the fastest-growing institution of higher education in Israel. The sterling academic experience provided by Bar-Ilan University is what one would expect from any world-class institution, in Israel or elsewhere: we impart knowledge to our students, and provide them with the critical ability and tools to analyze that knowledge, to study academic subjects with rigor and discipline, and apply their findings and understandings to contemporary realities.",http://www1.biu.ac.il/indexE.php
Baycrest Centre Foundation,Canada,"Baycrest is dedicated to achieving excellence in providing the best possible experience and care for the physical and mental wellbeing of people during their journey of aging. Founded in 1918 as the Jewish Home for Aged, Baycrest continues to embrace the long-standing tradition of all great Jewish healthcare institutions to improve the well-being of people in their local communities and around the globe.",http://www.baycrest.org/
Ben-Gurion University of the Negev,Israel,Ben-Gurion University of the Negev is one of Israel’s leading research universities and among the world leaders in many fields.,http://in.bgu.ac.il/en
Beth Hatefutsoth,Israel,This unique global institution tells the ongoing and extraordinary story of the Jewish people. Beit Hatfutsot connects Jewish people to their roots and strengthens their personal and collective Jewish identity.,http://www.bh.org.il/
Beit Midrash/A Liberal Yeshivah,United States,"Founded at Hebrew Union College's Jerusalem School, Beit Midrash/A Liberal Yeshivah offers congregational group visitors and adult learners from around the world opportunities for study and spiritual growth through program that immerses English-speaking Jews in the traditional texts and practices of Judaism. ",
Bezalel Academy of Arts and Design,Israel,"The name Bezalel is synonymous with more than 100 years of Israeli art, innovation and academic excellence.",http://www.bezalel.ac.il/en
Big Tent Judaism,United States,"For more than two decades, Big Tent Judaism (formerly known as Jewish Outreach Institute) has been opening the Jewish tent to all who wish to enter. If you’ve previously felt pushed out or underserved — or if you’ve simply never had a reason to engage — our goal is to welcome you (or welcome you back) with open arms.",http://bigtentjudaism.org/
Birthright Israel Foundation,United States,"Birthright Israel Foundation raises the necessary funds each year to support Birthright Israel. Through partnerships with the Government of Israel, the Jewish Federations of North America, the Jewish Agency for Israel and Keren Hayesod as well as the over 32,000 Birthright Israel Foundation donors each year, we work to ensure that Birthright Israel remains a gift to young Jewish adults for years to come.",https://birthrightisrael.foundation/contact.php
Bishop's University,Canada,"Bishop's University is a predominantly residential, undergraduate university. The primary concern is offering students a quality education in arts, sciences, business, and education.",http://www.ubishops.ca/
Bloomfield Science Museum in Jerusalem,Israel,"The Bloomfield Science Museum Jerusalem is an informal cultural and educational institution that presents exhibitions consisting of interactive exhibits on subjects of science and technology, and integrates these exhibits into a context through a wide range of educational activities.",http://www.mada.org.il/en
B'nai Brith Canada,Canada,"B’nai Brith has advocated for Canadian Jewry and championed the cause of human rights since 1875. B’nai Brith is recognized as a vital voice in promoting Jewish unity and continuity, a staunch defender of the State of Israel and global Jewry, a tireless advocate on behalf of senior citizens and a leader in combatting antisemitism & racism. B'nai Brith Canada is the action arm of the Jewish community.",http://www.bnaibrith.ca/
Boston University,United States,"It’s in our DNA: an inherent desire in each of our students, faculty, and staff to vigorously and dauntlessly pursue knowledge—and embrace the unlimited possibilities that come with it.",http://www.bu.edu/
Brandeis University,United States,"ACBP established The Institute for Informal Jewish Education (IJE) at Brandeis University with the mission to support Jewish educators in creating meaningful Jewish experiences. Brandeis University- Institute for Informal Jewish Education: Changing the landscape of informal Jewish education in North America by strengthening the field, supporting leading educators, and developing and testing innovative programs. ACBP funded one project in particular called the Seminar in Professional Leadership, a major innovation in professional training for informal Jewish educators. It built the first professional network in the field to cross denominational and organizational lines, encouraging promising professionals to stay in the field and aspire to leadership positions. IJE created the Leadership Letter, a semi-annual newsletter featuring articles by alumni about their collaborations with each other and other projects along with news of the Institute. 



The Jewish Futures Project reports are published by the Maurice and Marilyn Cohen Center for Modern Jewish Studies at Brandeis University. The reports aim to assess the impact of the Taglit-Birthright Israel program on the Jewish identity of participants once they return home. The research team is headed by Dr. Leonard Saxe, director of the Steinhardt Social Research Institute and Cohen Center for Modern Jewish Studies at Brandeis and the study is funded, among others, by Taglit-Birthright Israel and the Andrea and Charles Bronfman Philanthropies. ",http://www.brandeis.edu/cmjs/
Brandon University,Canada,"We promote excellence in teaching, research, creation and scholarship. We educate our students so that they can make a meaningful difference as engaged citizens and leaders. We defend academic freedom and responsibility. We create and disseminate new knowledge. We embrace cultural diversity and are particularly committed to the education of First Nations, Métis and Inuit people. We share our expertise and resources with the greater community.",https://www.brandonu.ca/
Breast Cancer Research Foundation,United States,"The mission of Breast Cancer Research Foundation is to prevent and cure breast cancer by advancing the world's most promising research at leading medical centers worldwide, and increasing public awareness about good breast health.",http://www.bcrfcure.org/
Bronfman Jewish Education Centre,Canada,BJEC is the planning and coordinating agency for Jewish community educational needs in Montreal. BJEC is responsible for the development of Jewish identity and continuity in our community through formal and informal Jewish education experiences and lifelong learning opportunities geared to all age groups.,http://www.bjec.org/
"B'Yachad (For a Jewish, Democratic Society in Israel)",Israel,"Kulanu seeks to create an inclusive Jewish society between the polarized groups: committed religious Jews and secular Israelis. Kulanu does this by seeking to strengthen the Jewish character of the State of Israel, enhancing democracy and fostering unity through its diverse projects. B'Yachad: For a Shared Jewish Democratic Society was a project of Kulanu. ",
Camp B'nai Brith Inc.,Canada,"Camp B’nai Brith of Montreal, established in 1920, has remained loyal to its founding charter of providing a Jewish camping experience to the children of our community.",http://cbbmtl.org/
Canadian Baseball Hall of Fame,Canada,"Since its inception as a non-profit, charitable foundation in October 1983, the Canadian Baseball Hall of Fame & Museum has been dedicated to preserving Canada’s rich baseball heritage. ",http://baseballhalloffame.ca/
Canadian Centre for Advanced Film Studies,Canada,"To launch Canada's most creative ideas and voices in film, television, screen acting, music, and digital media to the world.",http://www.cfccreates.com
Canadian Centre for Architecture,Canada,"The Canadian Centre for Architecture (CCA) was founded in 1979 as a new form of cultural institution to build public awareness of the role of architecture in society, promote scholarly research in the field, and stimulate innovation in design practice.",http://www.cca.qc.ca/en/
Canadian Clay & Glass Gallery,Canada,"The Canadian Clay and Glass Gallery is a long-standing site of excellence and a destination for contemporary art for international tourists and regional citizens. We host critically-acclaimed exhibitions that challenge ideas and perceptions of the definitions of art, craft and design today.",http://www.theclayandglass.ca/
Canadian Foundation for the Americas,Canada,"FOCAL was created as an independent, non-governmental think-tank meant to enhance co-operation and dialogue, create new linkages, and strengthen existing ties between countries of the hemisphere through policy analysis and discussion. The Canadian Foundation for the Americas (FOCAL) is no longer in operation, having ceased operations in 2011.",http://www.focal.ca/
Canadian Friends of Peace Now,Canada,"Peace Now (Shalom Achshav) is the largest and most effective peace movement in the history of Israel. Shalom Achshav works to promote peace with security for Israel, and a healthy democracy, through educational, advocacy and dialogue activities.",http://www.peacenowcanada.org/
Canadian Gene Cure Foundation,Canada,The Canadian Gene Cure Foundation will continue to create and sustain a cooperative research community in the field of human genetic disease which will increase the likelihood of successful discovery of cures and treatments for inherited diseases.,http://genecure.ca/en
Canadian Institute for Advanced Research,Canada,"CIFAR brings together top international researchers to create new knowledge that will change Canada and the world. Today, our global research networks are working on some of the most interesting and pressing questions of our time.",http://www.cifar.ca/
Canadian Jewish Congress,Canada,"Canadian Jewish Congress focused on outreach to ethnic and faith-based groups, civil society organizations and labour, and it worked to promote civil discourse, the constitutional rights and freedoms of all Canadians, and Jewish and Canadian shared values. The Centre for Israel and Jewish Affairs (CIJA), the merger between the Canadian Jewish Congress and many other groups, CIJA is a national, non-partisan, non-profit organization dedicated to improving the quality of Jewish life in Canada by advancing the public policy interests of Canada’s organized Jewish community.",http://www.cija.ca/
Canadian Museum of Immigration at Pier 21,Canada,Canada has been profoundly shaped by immigration. The Canadian Museum of Immigration at Pier 21 aims to inspire and enable Canadians to explore their relationships with those migrations.,http://www.pier21.ca/
Canadian Red Cross Society,Canada,The Canadian Red Cross mission is to improve the lives of vulnerable people by mobilizing the power of humanity in Canada and around the world.,http://www.redcross.ca/
Canadian Society for Yad Vashem,Canada,"The Canadian Society for Yad Vashem, The Holocaust Martyrs’ and Heroes’ Remembrance Authority, raises financial resources for Yad Vashem Jerusalem’s global initiatives and implements Yad Vashem’s vision of disseminating the facts and universal lessons of the Shoah across Canada through significant educational and commemorative initiatives.",http://www.yadvashem.ca/
Canadian Zionist Federation,Canada,"CZF is an organization expressly committed to Jewish education, Jewish culture and the centrality of Israel in Jewish life. CZF was established in 1967 as a national federation for Zionist organizations across Canada. It is the official representative and voice of Canadian Zionists to the World Zionist Organization, the body responsible for Israel/Diaspora relations. ACBP supported Canadian Youth Travel to Israel in the Youth & Hechalutz Department. ",
Cancer Research Institute,United States,"The Cancer Research Institute (CRI), established in 1953, is the world’s only nonprofit organization dedicated exclusively to transforming cancer patient care by advancing scientific efforts to develop new and effective immune system-based strategies to prevent, diagnose, treat, and eventually cure all cancers. The CRI Irvington Postdoctoral Fellowship Program, established in 1971, is CRI's longest-standing continuous program. Fellowships provide support to fund and train young immunologists and cancer immunologists at top universities and research centers around the world. ",http://www.cancerresearch.org/grants-programs/grants-fellowships/cri-irvington-postdoctoral-fellowships
