organization,location,description,website
Peaceworks Network Foundation,United States,"To amplify the voice of mainstream Israelis and Palestinians, empowering them to propel their elected representatives toward a two-state solution. The movement works to forge consensus for conflict resolution and build a human infrastructure capable of mobilizing the people toward a negotiated, comprehensive and permanent agreement between Israel and Palestine that ends the occupation, ensures security and peace for both sides, and solves all final-status issues in accordance with international law and previous bilateral agreements.",http://onevoicemovement.org/
Pearson College UWC,Canada,"Pearson College UWC is a two-year pre-university school (Grade 12 and Gap Year) for up to 200 students from over 100 countries who live, study and grow together at the edge of the western world. We believe that education is a force to unite people, nations and cultures for peace and a sustainable future.",http://www.pearsoncollege.ca/
Philanthropic Foundations Canada,Canada,"PFC promotes the growth and development of effective and responsible foundations and organized philanthropy in Canada through provision of membership services, resources and advocacy.",http://pfc.ca/contact/
Pilchuck Glass School,United States,"Pilchuck Glass School is an international center for glass art education. Our serene campus in Stanwood, Washington, is nestled in the foothills of the Cascade mountains on a former tree farm.",http://www.pilchuck.com/
Project Interchange,United States,"Project Interchange, an educational institute of AJC, brings opinion leaders and policy makers to Israel for a week of intensive travel and learning. Participants experience Israeli society, connect with their Israeli counterparts and learn about Israel’s extensive contributions in their fields.",http://projectinterchange.org/
Prosserman JCC ,Canada,"The Prosserman JCC (formerly the Bathurst Jewish Centre) fosters and enriches Jewish identity and builds community through health and wellness, recreation, education and culture, social experiences, and a strong connection to Israel.",http://www.prossermanjcc.com/
Queen Elizabeth Hospital of Montreal Foundation,Canada,Queen Elizabeth Hospital of Montreal Foundation is a not-for-profit organization whose mission is to raise funds to meet the needs of the Queen Elizabeth Health Complex. The QEHC is able to acquire new state-of-the-art equipment and offer free medical services through the generous support of its foundation.,http://www.qehc.org/foundation_about
Queen Elizabeth Scholars,Canada,"The Canadian Queen Elizabeth II Diamond Jubilee Scholarships aim to activate a dynamic community of young global leaders across Canada and the Commonwealth to create lasting impacts both at home and abroad through cross-cultural exchanges encompassing international education, discovery and inquiry, and professional experiences. This collaborative initiative is activated through Rideau Hall Foundation, Community Foundations of Canada, and Universities Canada.",http://www.queenelizabethscholars.ca/
Reboot,United States,"Reboot is a catalyst to catalysts. Every generation must grapple with the questions of Jewish identity, community and meaning on its own terms. Reboot exists to facilitate that process for this and future generations – providing the tools and methodologies to help ‘reboot’ inherited tradition and make it vital, resonant and meaningful in modern life.  Reboot is committed to creating opportunities for peers to gather, to engage, to question and to self-organize with their own networks, in their own way, in their own time. Founded in 2002, Reboot engages and inspires young, Jewishly-unconnected cultural creatives, innovators and thought-leaders who, through their candid and introspective conversations and creativity, generate projects that impact both the Jewish and non-Jewish worlds.",http://www.rebooters.net/
Rockefeller Philanthropy Advisors,United States,"Rockefeller Philanthropy Advisors (RPA) is a nonprofit organization that currently advises on and manages more than $200 million in annual giving by individuals, families, corporations, and major foundations. Rockefeller Philanthropy Advisors launched the “Theory of the Foundation” initiative, inspired by Peter Drucker’s famed article, The Theory of the Business. The framework allows funders to look at their giving, the environments in which they operate, and their core competencies with fresh eyes and renewed commitment.",https://www.rockpa.org/
Royal Ontario Museum Foundation,Canada,"The Royal Ontario Museum is among the world’s leading museums of natural history, and of world cultures. It is the ROM’s mission to engage the public in exploration of cultural change and to serve as an advocate for science in the study of nature.",www.rom.on.ca
Royal Ottawa Foundation for Mental Health ,Canada,"The Royal Ottawa Foundation for Mental Health (""Royal Ottawa Health Care Foundation"") raises funds to support the best possible patient care and leading edge research provided by the Royal Ottawa Mental Health Centre, the Brockville Mental Health Centre, and the uOttawa Institute of Mental Health Research. The Foundation’s funds are used to purchase hospital equipment for capital projects, to support research, and to contribute to the improvement of patient care, now and for the future.",http://www.theroyal.ca/foundation/
Royal Winnipeg Ballet,Canada,"The Royal Winnipeg Ballet enriches the human experience by teaching, creating and performing outstanding dance.",http://www.rwb.org/
Sally and Philip Lown Community Center,Israel,"The Sally & Philip W. Lown Youth & Community Center was one of the first community centers built in the city. The center provides an array of educational, recreational, social and cultural programs for children, youth, adults and seniors in the Kiryat Hayovel neighborhood, one of the largest neighborhoods in the city, with approximately 30,000 residents.",
Schepens Eye Research Institute,United States,"Schepens Eye Research Institute, Massachusetts Eye and Ear fights blindness by developing new technologies, therapies and knowledge to retain and restore vision. Through a continuum of discovery, the Institute works toward a future in which blindness is prevented, alleviated, and, ultimately, cured.",http://www.schepens.harvard.edu/
Seeds of Peace,United States,"Seeds of Peace inspires and equips new generations of leaders from regions of conflict with the relationships, understanding, and skills needed to advance lasting peace.",http://www.seedsofpeace.org/
Segal Centre for Performing Arts at the Saidye,Canada,"The Segal Centre is a meeting place for all of the performing arts, showcasing the best professional artists from here and abroad and playing a leading role in the artistic development of Montreal’s youth and the creation of its cultural legacy.",http://www.segalcentre.org/
Shalom Hartman Institute,Israel,"The Shalom Hartman Institute in Jerusalem is one of the world's leading centers of advanced Judaic research and educational leadership training.  Its major goal is the integration old traditional Judaism in modernity, while respecting the diversity in ideology that permeates Jewish life today.",http://hartman.org.il/
Shatil ,Israel,"Shatil, The New Israel Fund’s Initiative for Social Change, was established in 1982 to strengthen civil-society entities and promote democracy, tolerance, and social justice in Israel. Each year, Shatil provides more than 10,000 hours of capacity building and consultation services to over 400 organizations, movements, and coalitions.",http://english.shatil.org.il/
Sheba – Academic Medical Center Hospital,Israel,"Serving as a university teaching hospital (affiliated with the Sackler School of Medicine at Tel Aviv University) and as a tertiary referral center, the Sheba Medical Center, also known as Tel HaShomer Hospital, uniquely combines Israel's largest Acute Care Hospital with its national Rehabilitation Hospital. Sheba merges Israel's best advances in high-tech science and medicine with traditional healing services, including the finest nursing faculty and outstanding care for the elderly.",https://eng.sheba.co.il/
Shriners Hospitals For Children,Canada,"Shriners Hospitals for Children has a mission to provide the highest quality care to children with neuromusculoskeletal conditions, burn injuries and other special healthcare needs within a compassionate, family-centered and collaborative care environment; provide for the education of physicians and other healthcare professionals; conduct research to discover new knowledge that improves the quality of care and quality of life of children and families.",http://www.shrinershospitalsforchildren.org/
SickKids Foundation,Canada,"Established in 1972, SickKids Foundation raises funds on behalf of The Hospital for Sick Children. We inspire our communities to invest in health and scientific advances to improve the lives of children and their families in Canada and around the world. We inspire our communities to invest in health and scientific advances to improve the lives of children and their families in Canada and around the world.",http://www.sickkidsfoundation.com/
Sikkuy - The Association for the Advancement of Civic Equality,Israel,"Sikkuy (a ""chance"" or ""opportunity"" in Hebrew) is a non-partisan NGO in Israel that develops and implements projects to advance equality between Arab and Jewish citizens of Israel in government budgets, resource allocation, hiring policy, land usage, access to government services, etc.",http://www.sikkuy.org.il/?lang=en
Sinai Health Foundation,Canada,"Sinai Health Foundation (formerly Mount Sinai Hospital Foundation of Toronto) raises and stewards funds to support Sinai Health System comprised of Mount Sinai Hospital, Bridgepoint Active Healthcare, Lunenfeld-Tanenbaum Research Institute and Circle of Care. These organizations have come together to combine acute care, rehabilitation and complex care, home care, and other community-based services all fuelled by world-class research.",http://supportsinai.ca
Slingshot,United States,"The idea for Slingshot developed organically following a weekend retreat for a dozen young Jews in 2004 who were preparing to become involved in their family foundations. They imagined a Zagat-style guidebook and worked to produce Slingshot: A Resource Guide to Jewish Innovation to highlight the 50 most innovative nonprofits in North American Jewish life for themselves and their peers. The next-generation funders responsible for Slingshot took their concept a step further, and created the Slingshot Fund, a peer giving network, to support Jewish organizations that resonated with their generation. The Slingshot Fund exposes its next generation funders to a professional grant-making process. ",http://www.slingshotfund.org/
Society for the Protection of Nature in Israel,Israel,"The Society for the Protection of Nature in Israel (SPNI) is Israel's leading environmental non-profit organization. SPNI works both within the government system and outside it to protect Israel’s remaining open spaces. In 1996, ACBP supported the reintroduction of Persian Fallow Deer into the Upper Galilee. SPNI has been working since then to monitor the success of the herd. Due to the project's unprecedented success the decision was made to reintroduce Persian Fallow Deer into the Carmel Mountains. In 2000, ACBP became involved in planning the preservation of Eilat Bay by looking at all aspects, including: legal, scientific, and public awareness. Persian Fallow Deer became extinct in Israel at the beginning of the 20th Century. ",http://www.teva.org.il/english/
Spertus Institute of Jewish Studies,United States,"Spertus is a center for Jewish learning and culture that invites people of all backgrounds to explore the multifaceted Jewish experience. Spertus inspires learning, serves diverse communities, and fosters understanding for Jews and people of all faiths. ",http://spertus.edu/
St. George's School of Montreal,Canada,"St. George's School of Montreal provides a hands-on, well-balanced and rigorous educational experience.  Mindful of the different strengths and needs of all of our learners, we prepare each student for what lies ahead. ",http://www.stgeorges.qc.ca/
St. Justine Hospital Foundation,Canada,"Created in 1987 when the Fondation Justine-Lacoste-Beaubien and Fondation Sainte-Justine joined forces, the CHU Sainte-Justine Foundation is dedicated to providing children and mothers-to-be with a standard of care that is among the very best in the world. This is the goal underlying all of our fundraising efforts.",http://www.fondation-sainte-justine.org/en/
St. Mary's Hospital Foundation,Canada,St. Mary’s Hospital Foundation has remained faithful to its primary objective – to empower St. Mary’s Hospital Center to provide the community – our community – with the highest level of patient and family-centered care.,http://www.stmaryshospitalfoundation.ca/en/home
Stanford University,United States,"Located between San Francisco and San Jose in the heart of Silicon Valley, Stanford University is recognized as one of the world's leading research and teaching institutions.",http://www.stanford.edu/
Stanstead College,Canada,"Our mission is to provide students from Canada and around the world with a highly structured and supportive educational program in a small, secure environment. The Stanstead experience helps all students reach their full academic potential in preparation for university, develop healthy and active lifestyles, and understand the importance of respect, responsibility and self-discipline.",http://www.stansteadcollege.com
Strang Cancer Prevention Center,United States,"Strang, synonymous with cancer prevention, is the longest continuously operating cancer prevention institution in the world. Strang's mission is to promote cure by early detection and provide research to prevent cancer, including dissemination of information to the public, education for medical professionals, and support for cancer prevention research.",http://www.strang.org/
Summit School,Canada,"Founded in 1963, the school services over 550 special needs students by creating an individualized and enriching environment.  Summit School is a private school recognized and subsidized in the public interest by the Ministère de L'Education du Loisir et du Sport. ",http://www.summit-school.com/
Sun Youth Organization ,Canada,"Sun Youth works with individuals and families in need from the Greater Montreal area by providing a range of emergency services to ensure basic needs and to preserve people’s integrity, by contributing actively to crime prevention and by promoting physical, social and intellectual development of people through education, sports and recreation.",http://sunyouthorg.com/en/
Sundays of Culture in the Army,Israel,"Sundays of Culture in the Army enables soldiers to participate in a variety of cultural events, thereby enriching their personal lives during military service. The transition hours, on Sunday morning, between rest periods at home and return to an army base could be used to expose soldiers from all backgrounds to cultural experiences. Viewing a film, seeing a play, watching a movie, hearing a concert, or going to a ballet, and the discussions which follow the performances provide an opportunity to learn, experience, and interpret the world around them.",
Technion - Israel Institute of Technology,Israel,"In operation since 1924, the Technion is the oldest university in Israel. Since its founding, the institute has educated three generations of men and women who have played a key role in laying the country’s infrastructure and establishing its crucial defense and high-tech industries. In the new millennium, Technion’s role at the forefront of the global network of science and technology has never been more vital.",http://www.technion.ac.il/en/
Tel Aviv Sourasky Medical Center,Israel,"The mission of Medical Tourism at the Tel Aviv Sourasky Medical Center is to provide excellence in medical care to patients and visitors of all ages from throughout the world—to deliver quality, compassionate care, and offer premier diagnostic services, so that individuals and families can eliminate the burden of disease, optimize their physical and emotional health, and live their lives to the fullest.",http://www.tasmc.org.il/sites/en/Pages/default.aspx
Tel Aviv University,Israel,"Founded in 1956, Tel Aviv University is the largest university in Israel and is a major teaching and research center. In 2001, Tel Aviv University named The Center for the Media of the Jewish People in honor of Andrea and Charles Bronfman. In 2002, The Jaffee Center at the Institute for National Security Studies at Tel Aviv University inaugurated the Andrea and Charles Bronfman Program in Information Strategy. This award dwelt upon the question of how media impacts upon national decision making. ",http://english.tau.ac.il/
Temple Emanu-El of Palm Beach,United States,"At Temple Emanu-El of Palm Beach we strive to make our congregation a Kehillah Kedoshah – a Holy Community – one dedicated to Torah (Jewish Learning), Avodah (Prayer and Spiritual Growth), and Gimilut Hasadim (Personal Kindness, Community and Social Action).",http://www.tepb.org
The Abraham Joshua Heschel School,United States,"The Abraham Joshua Heschel School is an independent school named in memory of one of the great Jewish leaders, teachers, and activists of the 20th century. Unaffiliated with any single movement or synagogue, The Heschel School sees as essential the creating of a community with families from a wide range of Jewish backgrounds, practices, and beliefs.",http://www.heschel.org/
The American Jewish Committee (AJC),United States,"For more than a century, AJC has been the leading global Jewish advocacy organization. With offices across the United States and around the globe, and partnerships with Jewish communities worldwide, AJC works to enhance the well-being of the Jewish people and to advance human rights and democratic values for all. ",http://www.ajc.org/
The Andy Prize,Israel,"The Andrea M. Bronfman Prize for the Arts (“the Andy”) was initiated in June 2005 by Charles Bronfman to honor his wife Andy’s passion for and support of the crafts in Israel.  Launching the Prize a year before Andy’s untimely death at the age of sixty, Charles Bronfman continues his and Andy’s work in this field. The prize has become a showcase for Israeli decorative artists and is awarded annually in the fields of jewelry, ceramics, fashion, textile, or glass. The winner receives 50,000 NIS, an exhibition of works at the Tel Aviv Museum of Art and a catalogue of the exhibition.  In addition, one work of the artist is gifted to the Tel Aviv Museum and one to the Israel Museum in Jerusalem. Cooperation with the Tel Aviv Museum of Art has enabled the Andy Prize to gain wide recognition among artists and supporters of the crafts in Israel, and to be a catalyst for advancing the field.  As Charles Bronfman has stated: “The Andy is about excellence. By recognizing excellence, not only will Israeli decorative artists understand that their craftsmanship is on a par with the best in the world, but the international community will recognize it as well.”",http://www.theandy.org.il/en/
The Association for Canadian Studies in the United States ,United States,"The Association for Canadian Studies in the United States (ACSUS) is a multi-disciplinary membership based organization committed to raising awareness and understanding of Canada and the bilateral relationship. ACSUS supports research and academic activity through its publications, conferences, and grant programs; promotes the academy through active advocacy and outreach; and positions the community by profiling the scope and diversity of research undertaken by the ACSUS membership in the humanities and social sciences.",http://www.acsus.org
The Belmonte Science Laboratories for Youth,Israel,"The Belmonte Science Laboratories Center was created to raise the level of scientific study in the city's high schools. The $3.5 million center is located on the Hebrew University's Givat Ram campus, and is staffed by university professors and technicians. he advanced teaching labs on the Edmond J. Safra Campus of the Hebrew University (HU), working in close cooperation with the Israel Ministry of Education, are a cooperative venture involving the Hebrew University, the Jerusalem Municipality Education Department (""Manchi""), and the Jerusalem Foundation.",
The Bronfman Youth Fellowships in Israel,United States,"BYFI’s goal is that Bronfman Fellows become active participants, leaders, and agents for change in the Jewish and wider world.",http://www.bronfman.org/
The Brookings Institution,United States,"The Brookings Institution is a private nonprofit organization devoted to research, education, and publication on important issues of domestic and foreign policy. Its principal purpose is to bring the highest quality independent research and analysis to bear on current and emerging policy problems. The Foundation created the Charles and Andrea Bronfman Distinguished Visiting Fellow at the Saban Center at The Brookings Institution. ",http://www.brookings.edu/
The Centre for Israel and Jewish Affairs,Canada,"The Centre for Israel and Jewish Affairs is a non-partisan organization creating and implementing strategies to improve the quality of Jewish life in Canada and abroad, increase support for Israel, and strengthen the Canada-Israel relationship.",http://www.cija.ca/
The Center for Middle East Competitive Strategy,United States,"The Center for Middle East Competitive Strategy (C-MECS), a US non-profit organization, strives to advance stability, prosperity and peace in the Middle East.",
The Charles R. Bronfman Centre for the Israel Experience: Mifgashim,Israel,"The Charles R. Bronfman Centre for the Israel Experience: Mifgashim was created to assist Birthright Israel program purveyors and individuals interested in planning and implementing a structured mifgash. Mifgash, meaning ""encounter"" in Hebrew, refers to the multi-day peer-to-peer meeting between young adult Jews from abroad and from Israel. Every Birthright Israel trip incorporates Israelis of the same age who join the trips for five to ten days and experience Israel along with their peers from the Diaspora. 

In the first two years of Tagilt-Birthright Israel trips, the Mifgashim program was a meeting between Israelis and Diaspora participants that lasted a few hours.  Very quickly, though, it became a central and integral part of the ten-day educational experience.",
The Charles Bronfman Prize,United States,"The Charles Bronfman Prize celebrates the vision and endeavor of an individual or team under the age of fifty whose humanitarian work, combined with their Jewish values, has significantly improved the world. The goal of the Prize is to recognize dynamic leaders whose innovation and impact serve as inspiration for the next generations.",http://www.thecharlesbronfmanprize.com/
"The Charles Bronfman Institute for Personalized Medicine, Icahn School of Medicine at Mount Sinai ",United States,The mission of The Charles Bronfman Institute for Personalized Medicine is to personalize disease risk assessment and improve responsiveness to treatments for patients through innovative translational genomics and genetics research. Our goal is to pioneer new advancements in healthcare for patients and providers through the delivery of personalized data-driven clinical care.,http://icahn.mssm.edu/research/institutes/ipm
The Coalition for the Advancement of Jewish Education,United States,The original Coalition for the Advancement of Jewish Education (CAJE) was founded in 1976 and over the next 32 years changed the landscape of Jewish education in the US and beyond. NewCAJE is an organization in transition. A generation of seasoned educators is interacting with a new generation of Jewish educators to formulate a vision for an organization that will move into the future with this and every new generation of educators.,http://www.newcaje.org/
The College of William & Mary,United States,"We're famous for our rigorous liberal arts curriculum and our dedicated, engaged professors. Our students are nothing short of exceptional; they're scholars, athletes, activists, musicians, world travelers and generous volunteers. The Foundation created the Andrea and Charles Bronfman Distinguished Visiting Professorship in Judaic Studies.",http://www.wm.edu/
The Council for Canadian Unity,Canada,"The Canadian Unity Council began as the Canada Committee, became the Council For Canadian Unity and finally the Canadian Unity Council.  It was formed in the mid-1960’s by five or six Montreal businessmen with the mission of countering the growing separatist movement in Quebec at that time. The Council organized hundreds of symposia and discussions in every part of Canada.  There was not a province or territory where the CUC was not active from the very beginning.  Over its forty year history, the Council played a key role in promoting Canadian Unity through a variety of programs and activities. ",
